tweet_id,text,favorite_count,retweet_count,created_at
1652569283740721158,RT ANPMarkaz The ANP on Thursday filed a plea in the Peshawar High Court for the formation of a judicial commission to probe PTI chief I,0,73,Sun Apr 30 07:03:15 +0000 2023
1652569164106858497,RT rizwanmedia BradSherman Pakistan Politics Elections2023 PTI imranKhanPTI US Congressman Raises Concerns Over Alleged Persecut,0,49,Sun Apr 30 07:02:46 +0000 2023
1652568908149448711,RT paro1 PTIpromotionFBparo1Iqra4291Mahi0J1IKshz7891AZMo28pti1H50k1fzall1tmy950nkGhz97paro2S1,0,69,Sun Apr 30 07:01:45 +0000 2023
1652568547128688640,HumairaWajahat BhuttoZulfikar what else can be expected from a Pti zombie type,0,0,Sun Apr 30 07:00:19 +0000 2023
1652568431764316160,RT paro1 PTIpromotionFBparo1Iqra4291Mahi0J1IKshz7891AZMo28pti1H50k1fzall1tmy950nkGhz97paro2S1,0,69,Sun Apr 30 06:59:52 +0000 2023
1652567469918175232,RT ARYNEWSOFFICIAL Enough is enough ImranKhan to announce roadmap today after police raid PervaizElahis houseRead More https,0,198,Sun Apr 30 06:56:02 +0000 2023
1652567170180845571,April inflation may hit historic 38 but pti pmln ppp etc are busy in taking revenges from each others ridiculo,0,0,Sun Apr 30 06:54:51 +0000 2023
1652566597557698560,RT latestbreaking1 LHC to take up Imrans plea seeking dismissal of 121 cases on May 2 lahorehighcourt PTI ImranKhan,0,3,Sun Apr 30 06:52:34 +0000 2023
1652563543609475072,RT paro1 PTIpromotionFBparo1Iqra4291Mahi0J1IKshz7891AZMo28pti1H50k1fzall1tmy950nkGhz97paro2S1,0,69,Sun Apr 30 06:40:26 +0000 2023
1652563297835548672,fbhutto May Allah SWT keep you safe happy and gorgeous always Enjoy you life as much as you can PTI is waiting,0,0,Sun Apr 30 06:39:28 +0000 2023
1652562493741334528,RT AsadAToor BREAKING How many billions ImranKhanPTI made by selling PTI tickets of Punjab assembly How much PTI other leaders made,0,195,Sun Apr 30 06:36:16 +0000 2023
1652562431770775552,How could you say that 70 population stands with IK ur a journalist amp its ur moral duty to share true analyses,0,0,Sun Apr 30 06:36:01 +0000 2023
1652562266313703426,RT ShahzadmemonPPP Because of the Good governance of PTI the Director General of the World Health Organization has submitted a report t,0,3,Sun Apr 30 06:35:22 +0000 2023
1652561573758775296,Because of the Good governance of PTI the Director General of the World Health Organization has submitted a repor,9,3,Sun Apr 30 06:32:36 +0000 2023
1652558710907215873,RT SaleemFarrukh ALERT PTI is putting critical Pakistani institutions at risk with their dangerous political agenda Theyre spreadi,0,419,Sun Apr 30 06:21:14 +0000 2023
1652558549581455362,RT AsadAToor BREAKING How many billions ImranKhanPTI made by selling PTI tickets of Punjab assembly How much PTI other leaders made,0,195,Sun Apr 30 06:20:35 +0000 2023
1652558496884461569,RT Lailatweets IKs residence amp violent clash between police amp political workers erupted by throwing stones and petrol bombs from ins,0,121,Sun Apr 30 06:20:23 +0000 2023
1652556857746268161,While the Pakistani government has not taken steps to address some of the economic challenges facing the country s,0,0,Sun Apr 30 06:13:52 +0000 2023
1652556159734235136,RT rizwanmedia BradSherman Pakistan Politics Elections2023 PTI imranKhanPTI US Congressman Raises Concerns Over Alleged Persecut,0,49,Sun Apr 30 06:11:06 +0000 2023
1652554893180428288,PTIs announcement to hold a rally in Lahore on the occasion of LaborDay will be held on May 1 under the leader,0,0,Sun Apr 30 06:06:04 +0000 2023
1652554849089896448,PervaizElahis house raided PTIs announcement to continue negotiations with the government Pervez Elahis hous,0,0,Sun Apr 30 06:05:53 +0000 2023
1652554801106894848,RT AsadAToor EXCLUSIVe In an explosive audio leak of Najam Saqib former Chief Justice SaqibNisar via his son taking millions from PT,0,1777,Sun Apr 30 06:05:42 +0000 2023
1652554711114092544,If the assemblies end by May 14 they are ready for one day elections ImranKhans talk of dissolving the assembl,0,0,Sun Apr 30 06:05:20 +0000 2023
1652553679730245632,RT ThePakDaily PTI decides to continue talks with govtPakistan PTI ImranKhan,0,2,Sun Apr 30 06:01:14 +0000 2023
1652553368093736965,PTI decides to continue talks with govtPakistan PTI ImranKhan,4,2,Sun Apr 30 06:00:00 +0000 2023
1652553249692450816,This is how u are treated when a common party worker states facts before his party leaderNone of party in paki,0,0,Sun Apr 30 05:59:32 +0000 2023
1652553072973848576,RT lordsherrykhan Im not saying Imran Khan is Batman but have you ever seen them in the same room together ImranKhan PMofPak,0,3,Sun Apr 30 05:58:50 +0000 2023
1652552879197290497,RT AsadAToor EXCLUSIVe In an explosive audio leak of Najam Saqib former Chief Justice SaqibNisar via his son taking millions from PT,0,1777,Sun Apr 30 05:58:04 +0000 2023
1652552545598943233,PDM PTIDifference Policies are sameface is different only,0,0,Sun Apr 30 05:56:44 +0000 2023
1652552141481844737,RT paro1 PTIpromotionFBparo1Iqra4291Mahi0J1IKshz7891AZMo28pti1H50k1fzall1tmy950nkGhz97paro2S1,0,69,Sun Apr 30 05:55:08 +0000 2023
1652551760588988416,Imran Khan is strict about dealing with America while Shehbaz Sharif is favorable Capital TV,3,0,Sun Apr 30 05:53:37 +0000 2023
1652550584279646208,Yunhi hamesha ulajhti rahi he zulm se khalqNa unki rasm nai heNa apni reetThe divisions the fissures are not pol,3,1,Sun Apr 30 05:48:56 +0000 2023
1652548844444426241,Alleged Audio Leak of Former CJP Saqib Nisars son Part 1AudioLeak SaqibNisar ImranKhan pti,4,1,Sun Apr 30 05:42:02 +0000 2023
1652547948243288064,RT InsafPKTV Chairman PTI ImranKhanPTI s Address to Nation 29042023PTI InsafTV ImranKhan ImranKhanAddress,0,2,Sun Apr 30 05:38:28 +0000 2023
1652547228433776646,RT latestbreaking1 Toshakhana case Judge on leave hearing adjourned till May 3 Toshakhanacase NAB PTI,0,3,Sun Apr 30 05:35:36 +0000 2023
1652546852158595073,RT paro1 PTIpromotionFBparo1Iqra4291Mahi0J1IKshz7891AZMo28pti1H50k1fzall1tmy950nkGhz97paro2S1,0,69,Sun Apr 30 05:34:07 +0000 2023
1652546644070596610,RT AsadAToor EXCLUSIVe In an explosive audio leak of Najam Saqib former Chief Justice SaqibNisar via his son taking millions from PT,0,1777,Sun Apr 30 05:33:17 +0000 2023
1652546384032067584,RT paro1 PTIpromotionFBparo1Iqra4291Mahi0J1IKshz7891AZMo28pti1H50k1fzall1tmy950nkGhz97paro2S1,0,69,Sun Apr 30 05:32:15 +0000 2023
1652546048991084544,RT paro1 PTIpromotionFBparo1Iqra4291Mahi0J1IKshz7891AZMo28pti1H50k1fzall1tmy950nkGhz97paro2S1,0,69,Sun Apr 30 05:30:55 +0000 2023
1652545618710261761,RT paro1 PTIpromotionFBparo1Iqra4291Mahi0J1IKshz7891AZMo28pti1H50k1fzall1tmy950nkGhz97paro2S1,0,69,Sun Apr 30 05:29:12 +0000 2023
1652544820479500292,RT lordsherrykhan Im not saying Imran Khan is Batman but have you ever seen them in the same room together ImranKhan PMofPak,0,3,Sun Apr 30 05:26:02 +0000 2023
1652543575970725888,Im not saying Imran Khan is Batman but have you ever seen them in the same room together ImranKhan,32,3,Sun Apr 30 05:21:05 +0000 2023
1652543273670434818,What is Chicken Poxdrbilalhanif drbilalhanifpt healthcheckphysiotherapyclinic hcpcphysio talkwithbilalhanif,0,0,Sun Apr 30 05:19:53 +0000 2023
1652542121482784768,ishaqDar expresses sadness over the raid on the home of the PTI Punjab president and the infringement of chadar,1,0,Sun Apr 30 05:15:19 +0000 2023
1652542111504535552,ishaqDar expresses sadness over the raid on the home of the PTI Punjab president and the infringement of chadar,0,0,Sun Apr 30 05:15:16 +0000 2023
1652541878066356225,Greatest leader ImranKhan pti Pakistan,0,0,Sun Apr 30 05:14:21 +0000 2023
1652541420543307778,RT paro1 PTIpromotionFBparo1Iqra4291Mahi0J1IKshz7891AZMo28pti1H50k1fzall1tmy950nkGhz97paro2S1,0,69,Sun Apr 30 05:12:32 +0000 2023
1652541260027273216,RT AliSajjadceo Daily Minute Mirror MinuteMirrorpk Nation stands by PakArmy to defeat evil designs of antiPakistan elements PakPMO,0,43,Sun Apr 30 05:11:53 +0000 2023
1652539929715519489,RT AsadAToor EXCLUSIVe In an explosive audio leak of Najam Saqib former Chief Justice SaqibNisar via his son taking millions from PT,0,1777,Sun Apr 30 05:06:36 +0000 2023
1652539102368079873,RT paro1 PTIpromotionFBparo1Iqra4291Mahi0J1IKshz7891AZMo28pti1H50k1fzall1tmy950nkGhz97paro2S1,0,69,Sun Apr 30 05:03:19 +0000 2023
1652538115897151489,sufisal ImranKhanPTI ImranKhanPTI is only popular among Punjabi Urdu TV Anchors In next election he will not wi,0,0,Sun Apr 30 04:59:24 +0000 2023
1652536361193455618,The Hafiz G selected by Sharif will of course talk like Sharifs Body language of a company chief not army chief,0,0,Sun Apr 30 04:52:25 +0000 2023
1652536296617697281,RT paro1 PTIpromotionFBparo1Iqra4291Mahi0J1IKshz7891AZMo28pti1H50k1fzall1tmy950nkGhz97paro2S1,0,69,Sun Apr 30 04:52:10 +0000 2023
1652536074982260738,RT AsadAToor EXCLUSIVe In an explosive audio leak of Najam Saqib former Chief Justice SaqibNisar via his son taking millions from PT,0,1777,Sun Apr 30 04:51:17 +0000 2023
1652535889070030849,RT paro1 PTIpromotionFBparo1Iqra4291Mahi0J1IKshz7891AZMo28pti1H50k1fzall1tmy950nkGhz97paro2S1,0,69,Sun Apr 30 04:50:33 +0000 2023
1652535140646617089,KhaleejMag leader who is safeguarding rights and interest of Pakistan nation but the entire Muslim umma,0,0,Sun Apr 30 04:47:34 +0000 2023
1652534646322900993,RT LageRahoKashmir HowPakArmyRunsPakistan by ImranKhan selected as PM by GenBajwa Bajwa toppled PTI GovtI should not have truste,0,1,Sun Apr 30 04:45:36 +0000 2023
1652533287871725568,RT paro1 PTIpromotionFBparo1Iqra4291Mahi0J1IKshz7891AZMo28pti1H50k1fzall1tmy950nkGhz97paro2S1,0,69,Sun Apr 30 04:40:13 +0000 2023
1652533080190603264,RT AsadAToor EXCLUSIVe In an explosive audio leak of Najam Saqib former Chief Justice SaqibNisar via his son taking millions from PT,0,1777,Sun Apr 30 04:39:23 +0000 2023
1652532786539143169,RT AsadAToor EXCLUSIVe In an explosive audio leak of Najam Saqib former Chief Justice SaqibNisar via his son taking millions from PT,0,1777,Sun Apr 30 04:38:13 +0000 2023
1652532600723091456,RT mughalbha Thread 8 Mr adilshahzeb explains the case of ImranKhan amp PTI Ties with USA in view of DiplomaticCypher amp US conspira,0,2,Sun Apr 30 04:37:29 +0000 2023
1652532247285874689,RT mughalbha Thread 8 Mr adilshahzeb explains the case of ImranKhan amp PTI Ties with USA in view of DiplomaticCypher amp US conspira,0,2,Sun Apr 30 04:36:04 +0000 2023
1652528717959233540,RT ARYNEWSOFFICIAL Enough is enough ImranKhan to announce roadmap today after police raid PervaizElahis houseRead More https,0,198,Sun Apr 30 04:22:03 +0000 2023
1652528602863345664,RT MohsinK47193824 Rezashah786 Army is real enemy of Pakistanis driving divide by sleeping with thieves robbers and dacoits of Pakis,0,1,Sun Apr 30 04:21:36 +0000 2023
1652525865006424073,RT AsadAToor EXCLUSIVe In an explosive audio leak of Najam Saqib former Chief Justice SaqibNisar via his son taking millions from PT,0,1777,Sun Apr 30 04:10:43 +0000 2023
1652525322170949633,RT UlTunger EXCLUSIVe In an explosive audio leak of Najam Saqib former Chief Justice SaqibNisar via his son taking millions from PT,0,1,Sun Apr 30 04:08:33 +0000 2023
1652524941395329026,RT InsafPKTV Chairman PTI ImranKhanPTI s Address to Nation 29042023PTI InsafTV ImranKhan ImranKhanAddress,0,2,Sun Apr 30 04:07:03 +0000 2023
1652524897178927104,RT AsadAToor EXCLUSIVe In an explosive audio leak of Najam Saqib former Chief Justice SaqibNisar via his son taking millions from PT,0,1777,Sun Apr 30 04:06:52 +0000 2023
1652524397649854464,RT paro1 PTIpromotionFBparo1Iqra4291Mahi0J1IKshz7891AZMo28pti1H50k1fzall1tmy950nkGhz97paro2S1,0,69,Sun Apr 30 04:04:53 +0000 2023
1652524351848103936,RT najamsheraz Allah hu Akbar This boys eyes are so bright Even with one hand he looks so positive and string that I apologies to All,0,30,Sun Apr 30 04:04:42 +0000 2023
1652522292520386560,RedHussaini FaisalYousaf66 AzharMKhan3 True It wasnt Mohsin Naqvi all himself Our main problem is our ineffi,3,0,Sun Apr 30 03:56:31 +0000 2023
1652521556608688130,RT paro1 PTIpromotionFBparo1Iqra4291Mahi0J1IKshz7891AZMo28pti1H50k1fzall1tmy950nkGhz97paro2S1,0,69,Sun Apr 30 03:53:36 +0000 2023
1652521512375648258,RT paro1 PTIpromotionFBparo1Iqra4291Mahi0J1IKshz7891AZMo28pti1H50k1fzall1tmy950nkGhz97paro2S1,0,69,Sun Apr 30 03:53:25 +0000 2023
1652521485838295040,RT aleewaraich Condemned the barbaric act by Punjab police of the imported Government attacking the residence of PervaizElahi PTIoffici,0,1,Sun Apr 30 03:53:19 +0000 2023
1652521083353067521,How terrible it is Pervaiz Elahi who was a certified thief as per ImranKhan and now the whole machinery of PTI is trying to protect him,0,0,Sun Apr 30 03:51:43 +0000 2023
1652520424482193411,RT AsadAToor EXCLUSIVe In an explosive audio leak of Najam Saqib former Chief Justice SaqibNisar via his son taking millions from PT,0,1777,Sun Apr 30 03:49:06 +0000 2023
1652520361974722560,RT paro1 PTIpromotionFBparo1Iqra4291Mahi0J1IKshz7891AZMo28pti1H50k1fzall1tmy950nkGhz97paro2S1,0,69,Sun Apr 30 03:48:51 +0000 2023
1652519935665422336,Chairman PTI ImranKhanPTI s Address to Nation 29042023PTI InsafTV ImranKhan ImranKhanAddress,4,2,Sun Apr 30 03:47:09 +0000 2023
1652519787015159811,RT paro1 PTIpromotionFBparo1Iqra4291Mahi0J1IKshz7891AZMo28pti1H50k1fzall1tmy950nkGhz97paro2S1,0,69,Sun Apr 30 03:46:34 +0000 2023
1652519027506548739,PTI BJP on same page over Bilawal upcoming Indias visit ShaziaPTI BJP Newspaper,0,0,Sun Apr 30 03:43:33 +0000 2023
1652518229074644992,Son of ex CJP allegedly sold PTI tickets in latest audio leaksexCJP PTI AudioLeaks Newspaper,0,0,Sun Apr 30 03:40:22 +0000 2023
1652517707101745153,RT AsadAToor BREAKING How many billions ImranKhanPTI made by selling PTI tickets of Punjab assembly How much PTI other leaders made,0,195,Sun Apr 30 03:38:18 +0000 2023
1652516074968043526,RT AsadAToor EXCLUSIVe In an explosive audio leak of Najam Saqib former Chief Justice SaqibNisar via his son taking millions from PT,0,1777,Sun Apr 30 03:31:49 +0000 2023
1652515855438061573,RT AsadAToor EXCLUSIVe In an explosive audio leak of Najam Saqib former Chief Justice SaqibNisar via his son taking millions from PT,0,1777,Sun Apr 30 03:30:56 +0000 2023
1652514724624433153,RT paro1 PTIpromotionFBparo1Iqra4291Mahi0J1IKshz7891AZMo28pti1H50k1fzall1tmy950nkGhz97paro2S1,0,69,Sun Apr 30 03:26:27 +0000 2023
1652514704781189120,RT AsadAToor EXCLUSIVe In an explosive audio leak of Najam Saqib former Chief Justice SaqibNisar via his son taking millions from PT,0,1777,Sun Apr 30 03:26:22 +0000 2023
1652513217288060928,RT paro1 PTIpromotionFBparo1Iqra4291Mahi0J1IKshz7891AZMo28pti1H50k1fzall1tmy950nkGhz97paro2S1,0,69,Sun Apr 30 03:20:27 +0000 2023
1652511014951460870,RT smoazzamhussain MaryamNSharif But the loss incurred to millions of Pakistanis is unforgivablelodge a complaint in FIA to investigate,0,1,Sun Apr 30 03:11:42 +0000 2023
1652509082442518528,MarwatSahab Read the comments under her tweet their hatred the filth in their hearts towards Gen Asim amp their l,3,1,Sun Apr 30 03:04:02 +0000 2023
1652507564318261252,RT paro1 PTIpromotionFBparo1Iqra4291Mahi0J1IKshz7891AZMo28pti1H50k1fzall1tmy950nkGhz97paro2S1,0,69,Sun Apr 30 02:58:00 +0000 2023
1652506565033840641,TaqdeesGillani LOTI mandate robberer PTIAJK She is the one who was elected,0,0,Sun Apr 30 02:54:01 +0000 2023
1652505761564741632,ImranKhanPTI PTI should cancel all negotiations and sittings with govt n PDMDreaming public lynching Its obvi,1,0,Sun Apr 30 02:50:50 +0000 2023
1652505434631319552,RT najamsheraz Allah hu Akbar This boys eyes are so bright Even with one hand he looks so positive and string that I apologies to All,0,30,Sun Apr 30 02:49:32 +0000 2023
1652504605719404544,AishaKhanPK PTI should cancel all negotiations and sitting with govt n PDM Dreaming public lynching Its obviou,0,0,Sun Apr 30 02:46:14 +0000 2023
1652504197328150528,RT AsadAToor EXCLUSIVe In an explosive audio leak of Najam Saqib former Chief Justice SaqibNisar via his son taking millions from PT,0,1777,Sun Apr 30 02:44:37 +0000 2023
1652503748105900033,MoonisElahi6 ImranKhanPTI PTI should cancel all negotiations and sitting with govt n PDM Dreaming public lynch,0,0,Sun Apr 30 02:42:50 +0000 2023
1652503661619052547,I stand with chAdilSaeed Gujjer PP201 Elections2023PTI AsadUmar ImranKhanPTI RaiHassanNawaz1,2,1,Sun Apr 30 02:42:29 +0000 2023
1652503186677088261,RT AsadAToor EXCLUSIVe In an explosive audio leak of Najam Saqib former Chief Justice SaqibNisar via his son taking millions from PT,0,1777,Sun Apr 30 02:40:36 +0000 2023
1652502614108688384,notghuf Govt has already taken away most of the protocol of IKThis is the love of the people of Pak for the gr,0,0,Sun Apr 30 02:38:19 +0000 2023
1652502511667015681,BOLNETWORK SHABAZGIL PTI should cancel all negotiations and sitting with govt n PDM Dreaming public lynching I,0,0,Sun Apr 30 02:37:55 +0000 2023
1652502507279753216,ashesskhan notghuf Govt has already taken away most of the protocol of IKThis is the love of the people of Pa,0,0,Sun Apr 30 02:37:54 +0000 2023
1652502371585638400,siasatpk PTI should cancel all negotiations and sitting with govt n PDM Dreaming public lynching Its obvious P,0,0,Sun Apr 30 02:37:22 +0000 2023
1652502035336503299,RT nayadaurpk PTIs leadership is extremely worried that PDM would do the same to the economy near the end of their tenure as the PTI,0,3,Sun Apr 30 02:36:01 +0000 2023
1652501962594852866,notghuf This is the respect given to IK PTI by the people of PakYou will never get the pointThis is not used by the Govt money,0,0,Sun Apr 30 02:35:44 +0000 2023
1652501850422390786,BOLNETWORK PTI should cancel all negotiations and sitting with govt n PDM Dreaming public lynching Its obvious,0,0,Sun Apr 30 02:35:17 +0000 2023
1652501723569614848,RT paro1 PTIpromotionFBparo1Iqra4291Mahi0J1IKshz7891AZMo28pti1H50k1fzall1tmy950nkGhz97paro2S1,0,69,Sun Apr 30 02:34:47 +0000 2023
1652501627734208513,BOLNETWORK ImranKhanPTI PTIofficial PTI should cancel all negotiations and sitting with govt n PDM Dreaming p,0,0,Sun Apr 30 02:34:24 +0000 2023
1652501336855052289,Jhagra PTI should cancel all negotiations and sitting with govt n PDM Dreaming public lynching Its obvious PML,0,0,Sun Apr 30 02:33:15 +0000 2023
1652501168004775938,RT AhmadRehanKhan Then they ask why doctors are leaving Pakistan In this inflation how can one support himherself and their familie,0,9,Sun Apr 30 02:32:35 +0000 2023
1652500523310891008,Kali Carenza Double Barongs Liveblade gtgt FMA JKD mma kali escrima martialarts,0,0,Sun Apr 30 02:30:01 +0000 2023
1652500409821347841,KhizarKahloon I agree the establishment actually changed the election results in 2018 and gave PTI seats to othe,1,0,Sun Apr 30 02:29:34 +0000 2023
1652499837097738240,OryaMaqboolJan PTI should cancel all negotiations and sitting with govt n PDM Dreaming public lynching Its obv,0,0,Sun Apr 30 02:27:17 +0000 2023
1652495134016303104,RT paro1 PTIpromotionFBparo1Iqra4291Mahi0J1IKshz7891AZMo28pti1H50k1fzall1tmy950nkGhz97paro2S1,0,69,Sun Apr 30 02:08:36 +0000 2023
1652491647039488001,PP 194 ticket sold should be investigated audioleak pti ImranKhan pp194,0,0,Sun Apr 30 01:54:45 +0000 2023
1652489716934103040,RT AsadAToor BREAKING How many billions ImranKhanPTI made by selling PTI tickets of Punjab assembly How much PTI other leaders made,0,195,Sun Apr 30 01:47:04 +0000 2023
1652486195841040386,RT AsadAToor EXCLUSIVe In an explosive audio leak of Najam Saqib former Chief Justice SaqibNisar via his son taking millions from PT,0,1777,Sun Apr 30 01:33:05 +0000 2023
1652482918240092160,Imran Khan The True StatesmanFor more videos Please Visit imrankhan trending,0,0,Sun Apr 30 01:20:04 +0000 2023
1652479432219582466,RT AsadAToor EXCLUSIVe In an explosive audio leak of Najam Saqib former Chief Justice SaqibNisar via his son taking millions from PT,0,1777,Sun Apr 30 01:06:12 +0000 2023
1652478529143971841,RT AsadAToor BREAKING How many billions ImranKhanPTI made by selling PTI tickets of Punjab assembly How much PTI other leaders made,0,195,Sun Apr 30 01:02:37 +0000 2023
1652477568090624001,RT paro1 PTIpromotionFBparo1Iqra4291Mahi0J1IKshz7891AZMo28pti1H50k1fzall1tmy950nkGhz97paro2S1,0,69,Sun Apr 30 00:58:48 +0000 2023
1652475433340813312,RT faizefaizan5 Prime minister of 2023 imranKhanPTIeidmubarak eid eid2023 eid2023 EidMubarak20239thaprilblackday,0,1,Sun Apr 30 00:50:19 +0000 2023
1652474244343689218,RT paro1 PTIpromotionFBparo1Iqra4291Mahi0J1IKshz7891AZMo28pti1H50k1fzall1tmy950nkGhz97paro2S1,0,69,Sun Apr 30 00:45:35 +0000 2023
1652473877308624896,RT paro1 PTIpromotionFBparo1Iqra4291Mahi0J1IKshz7891AZMo28pti1H50k1fzall1tmy950nkGhz97paro2S1,0,69,Sun Apr 30 00:44:08 +0000 2023
1652473156018249728,RT AsadAToor EXCLUSIVe In an explosive audio leak of Najam Saqib former Chief Justice SaqibNisar via his son taking millions from PT,0,1777,Sun Apr 30 00:41:16 +0000 2023
1652472968205811712,Wait For My Leader ImranKhan ImranKhanPTI PTI PMIK PMImranKhan reels viral,0,0,Sun Apr 30 00:40:31 +0000 2023
1652472633370484736,Daily Sindh Best is a ABC Certified Newspaper of Sindhi Language Sindhbestdigital Sindhbestnewspaper,0,0,Sun Apr 30 00:39:11 +0000 2023
1652471987577712640,Daily Sindh Best is a ABC Certified Newspaper of Sindhi Language Sindhbestdigital Sindhbestnewspaper,0,0,Sun Apr 30 00:36:37 +0000 2023
1652471166760808451,RT AsadAToor BREAKING How many billions ImranKhanPTI made by selling PTI tickets of Punjab assembly How much PTI other leaders made,0,195,Sun Apr 30 00:33:22 +0000 2023
1652467830250504192,RT ARYNEWSOFFICIAL Enough is enough ImranKhan to announce roadmap today after police raid PervaizElahis houseRead More https,0,198,Sun Apr 30 00:20:06 +0000 2023
1652467352397545473,RT AsadAToor EXCLUSIVe In an explosive audio leak of Najam Saqib former Chief Justice SaqibNisar via his son taking millions from PT,0,1777,Sun Apr 30 00:18:12 +0000 2023
1652466850499006464,RT AsadAToor EXCLUSIVe In an explosive audio leak of Najam Saqib former Chief Justice SaqibNisar via his son taking millions from PT,0,1777,Sun Apr 30 00:16:13 +0000 2023
1652466796405092352,RT SameStatusWG Share it Contact to join SSV Group03329783166 PDMPTIBhaiBhaipetrol,0,5,Sun Apr 30 00:16:00 +0000 2023
1652466135265349632,RT AsadAToor EXCLUSIVe In an explosive audio leak of Najam Saqib former Chief Justice SaqibNisar via his son taking millions from PT,0,1777,Sun Apr 30 00:13:22 +0000 2023
1652465030741508096,RT AsadAToor EXCLUSIVe In an explosive audio leak of Najam Saqib former Chief Justice SaqibNisar via his son taking millions from PT,0,1777,Sun Apr 30 00:08:59 +0000 2023
1652461284296736768,RT AsadAToor BREAKING How many billions ImranKhanPTI made by selling PTI tickets of Punjab assembly How much PTI other leaders made,0,195,Sat Apr 29 23:54:06 +0000 2023
1652459670101979138,RT paro1 PTIpromotionFBparo1Iqra4291Mahi0J1IKshz7891AZMo28pti1H50k1fzall1tmy950nkGhz97paro2S1,0,69,Sat Apr 29 23:47:41 +0000 2023
1652458381137924096,RT AsadAToor EXCLUSIVe In an explosive audio leak of Najam Saqib former Chief Justice SaqibNisar via his son taking millions from PT,0,1777,Sat Apr 29 23:42:33 +0000 2023
1652455776819064834,RT AsadAToor BREAKING How many billions ImranKhanPTI made by selling PTI tickets of Punjab assembly How much PTI other leaders made,0,195,Sat Apr 29 23:32:12 +0000 2023
1652454729484730368,RT AsadAToor EXCLUSIVe In an explosive audio leak of Najam Saqib former Chief Justice SaqibNisar via his son taking millions from PT,0,1777,Sat Apr 29 23:28:03 +0000 2023
1652453682447826946,RT AsadAToor EXCLUSIVe In an explosive audio leak of Najam Saqib former Chief Justice SaqibNisar via his son taking millions from PT,0,1777,Sat Apr 29 23:23:53 +0000 2023
1652452377868349446,RT AsadAToor EXCLUSIVe In an explosive audio leak of Najam Saqib former Chief Justice SaqibNisar via his son taking millions from PT,0,1777,Sat Apr 29 23:18:42 +0000 2023
1652447312659005442,RT MehdiHassain2 Part 02trying to attack the sovereignty of our motherland ISPR COAS ISI MI SHARE ARMY PTIkhushbakht76M,0,2,Sat Apr 29 22:58:34 +0000 2023
1652446818398003202,RT TFT According to the PTI chief any attempt to dissolve the assemblies after the budget will be unacceptable for his partyImra,0,1,Sat Apr 29 22:56:37 +0000 2023
1652444650085691392,According to the PTI chief any attempt to dissolve the assemblies after the budget will be unacceptable for his,0,1,Sat Apr 29 22:48:00 +0000 2023
1652444427875680256,According to the PTI chief any attempt to dissolve the assemblies after the budget will be unacceptable for his,0,0,Sat Apr 29 22:47:07 +0000 2023
1652443456206241795,MarriyumA I see a dead women in it PMLN PTI Pakistan,0,0,Sat Apr 29 22:43:15 +0000 2023
1652443372487942145,RT AsadAToor EXCLUSIVe In an explosive audio leak of Najam Saqib former Chief Justice SaqibNisar via his son taking millions from PT,0,1777,Sat Apr 29 22:42:55 +0000 2023
1652440376127397889,RT ARYNEWSOFFICIAL PTI chief Khan strongly condemned the police action against Elahi saying that it was an illegal raid on his home wit,0,76,Sat Apr 29 22:31:01 +0000 2023
1652440318690697216,RT paro1 PTIpromotionFBparo1Iqra4291Mahi0J1IKshz7891AZMo28pti1H50k1fzall1tmy950nkGhz97paro2S1,0,69,Sat Apr 29 22:30:47 +0000 2023
1652438000607870979,RT AsadAToor EXCLUSIVe In an explosive audio leak of Najam Saqib former Chief Justice SaqibNisar via his son taking millions from PT,0,1777,Sat Apr 29 22:21:34 +0000 2023
1652437850346979329,RT nayadaurpk PTIs leadership is extremely worried that PDM would do the same to the economy near the end of their tenure as the PTI,0,3,Sat Apr 29 22:20:58 +0000 2023
1652437139601367042,RT AsadAToor EXCLUSIVe In an explosive audio leak of Najam Saqib former Chief Justice SaqibNisar via his son taking millions from PT,0,1777,Sat Apr 29 22:18:09 +0000 2023
